{
  "schemaVersion": "dhp-profile-page.v1",
  "sourceSummary": {
    "generatedFor": "Jordan Lee",
    "targetRoles": [
      "Content Coordinator",
      "Marketing Assistant",
      "Social Media Assistant",
      "Communications Assistant",
      "Graduate Marketing role"
    ],
    "assumptions": [
      "The user wants a DHP profile page JSON object.",
      "The user wants the JSON object to strictly follow the provided schema.",
      "The user wants the JSON object to be in a product-system tone.",
      "The user wants the JSON object to be consistent, structured, and ready for a frontend renderer.",
      "The user wants only valid JSON output, without markdown, comments, or code fences."
    ],
    "unverifiedOrPending": [
      "Degree verification status is pending.",
      "Campaign project evidence needs to be uploaded.",
      "AI readiness needs stronger evidence for prompt framing, output checking, and privacy judgement."
    ]
  },
  "user": {
    "fullName": "Jordan Lee",
    "initials": "JL",
    "age": 24,
    "email": "jordan.lee@example.com",
    "phone": "0400 125 642",
    "location": "Sydney, NSW"
  },
  "profileHeader": {
    "railLabels": [
      "Story",
      "Skill",
      "Proof",
      "Trust",
      "Index"
    ],
    "headline": "Communications graduate seeking entry-level content or marketing roles.",
    "metaFacts": [
      "Bachelor of Communications",
      "University of Technology Sydney",
      "24 years old",
      "Sydney, NSW"
    ],
    "readinessScore": 74,
    "indexLinks": [
      {
        "id": "vei",
        "label": "VEI",
        "score": 78,
        "subtitle": "Opportunity fit",
        "targetPage": "opportunities",
        "tone": "ready"
      },
      {
        "id": "vci",
        "label": "VCI",
        "score": 73,
        "subtitle": "Capability layers",
        "targetPage": "vci",
        "tone": "proof"
      }
    ]
  },
  "dhpView": {
    "personalStory": "A recent graduate from UTS with a Bachelor of Communications, Jordan is seeking an entry-level role in marketing or content creation. Currently working in hospitality, Jordan is eager to apply developed skills in writing, audience awareness, and communication to a professional setting. Jordan feels a disconnect in the current job market and is looking for opportunities to demonstrate capabilities and build a career.",
    "insightCards": [
      {
        "id": "career-goal",
        "title": "Career Direction",
        "body": "Seeking an entry-level content or marketing role to demonstrate writing, customer empathy, and project thinking.",
        "tone": "neutral"
      },
      {
        "id": "work-style",
        "title": "Work Style",
        "body": "Customer-facing experience in hospitality has developed communication, prioritisation, and resilience. University projects show research, planning, and campaign thinking.",
        "tone": "proof"
      },
      {
        "id": "ai-readiness",
        "title": "AI Readiness",
        "body": "Uses AI tools like ChatGPT and Notion AI for drafting and research summaries. Needs to strengthen prompt framing, output checking, and privacy judgement.",
        "tone": "growth"
      }
    ],
    "skillsWithEvidence": [
      {
        "id": "skill-copywriting",
        "name": "Copywriting",
        "level": "Working",
        "confidence": 4,
        "context": "Attached writing sample, portfolio pieces, cover letters, and university campaign copy.",
        "evidence": "Writing sample attached.",
        "status": "verified"
      },
      {
        "id": "skill-customer-communication",
        "name": "Customer Communication",
        "level": "Confident",
        "confidence": 5,
        "context": "Practised daily through hospitality work and complaint resolution.",
        "evidence": "Hospitality work experience.",
        "status": "verified"
      },
      {
        "id": "skill-research-content-planning",
        "name": "Research and Content Planning",
        "level": "Working",
        "confidence": 4,
        "context": "Used in a university campaign strategy project for a youth audience.",
        "evidence": "University campaign strategy project.",
        "status": "needs evidence"
      },
      {
        "id": "skill-canva",
        "name": "Canva",
        "level": "Basic to Working",
        "confidence": 3,
        "context": "Used in university projects and personal use.",
        "evidence": "Mentioned in university campaign project.",
        "status": "suggested"
      }
    ],
    "trustAndConsent": [
      {
        "id": "verification-working-rights",
        "type": "Working rights",
        "status": "Verified",
        "visibility": "Employer on request",
        "note": "Verification status stored, not raw document.",
        "tone": "proof"
      },
      {
        "id": "verification-degree",
        "type": "Degree",
        "status": "Pending",
        "visibility": "Employer on request",
        "note": "Qualification claim exists, verification result pending.",
        "tone": "warning"
      }
    ]
  },
  "resumeView": {
    "education": [
      {
        "qualification": "Bachelor of Communications",
        "institution": "University of Technology Sydney",
        "status": "Completed - Pending Verification"
      }
    ],
    "experiences": [
      {
        "title": "Hospitality Team Member",
        "organisation": "Casual Shifts",
        "detail": "Provided customer-facing service during busy periods, handling requests and resolving issues. Collaborated with team members under pressure, demonstrating reliability, prioritisation, and resilience."
      }
    ],
    "projects": [
      {
        "title": "University Campaign Strategy Project",
        "role": "Student",
        "outcome": "Developed audience research, channel planning, and sample campaign content.",
        "status": "Ready to Attach"
      },
      {
        "title": "Writing Sample",
        "role": "Student/Portfolio",
        "outcome": "Demonstrates copywriting and written communication skills.",
        "status": "Attached"
      }
    ],
    "applications": [
      {
        "title": "Marketing Intern",
        "employer": "Hatch listing",
        "status": "Viewed",
        "note": "Employer viewed DHP summary."
      },
      {
        "title": "Content Assistant",
        "employer": "LinkedIn listing",
        "status": "Submitted",
        "note": "No employer activity."
      }
    ]
  },
  "matchPanel": {
    "title": "Capability match",
    "intro": "Jordan can see where his DHP is already verified, where proof is missing, and what is better treated as a growth path.",
    "selectedMatchId": "marketing-assistant",
    "opportunities": [
      {
        "id": "content-coordinator",
        "title": "Junior Content Coordinator",
        "employer": "Civic Spark Studio",
        "status": "ready",
        "matchScore": 86,
        "summary": "Strong fit for writing, research, Canva, and customer empathy.",
        "matchedSkills": [
          "Copywriting",
          "Research",
          "Canva",
          "Customer empathy"
        ],
        "missing": [],
        "nextAction": "Apply now"
      },
      {
        "id": "marketing-assistant",
        "title": "Marketing Assistant",
        "employer": "Social Impact Collective",
        "status": "needs-info",
        "matchScore": 75,
        "summary": "Close match, but needs clearer qualification proof and campaign evidence.",
        "matchedSkills": [
          "Content planning",
          "Customer communication",
          "Canva"
        ],
        "missing": [
          {
            "id": "degree-verification",
            "label": "Degree verification",
            "type": "Verification",
            "detail": "The employer asks for completed qualification evidence. Store the result, not the raw document, by default."
          },
          {
            "id": "campaign-evidence",
            "label": "Campaign project evidence",
            "type": "Evidence",
            "detail": "Attach the university campaign strategy project so the employer can see how Jordan thinks."
          }
        ],
        "nextAction": "Update profile with evidence"
      },
      {
        "id": "campaign-assistant",
        "title": "Digital Campaign Assistant",
        "employer": "BrightDesk Media",
        "status": "growth",
        "matchScore": 65,
        "summary": "Growth opportunity, needs analytics evidence before applying.",
        "matchedSkills": [
          "Writing",
          "Audience research",
          "Presentation"
        ],
        "missing": [
          {
            "id": "analytics-evidence",
            "label": "Analytics evidence",
            "type": "Growth skill",
            "detail": "The role asks for basic campaign reporting. Recommend a short analytics learning task and a small evidence item."
          }
        ],
        "nextAction": "Develop analytics skills"
      }
    ]
  },
  "indexes": {
    "readinessSignals": [
      {
        "label": "Profile completeness",
        "value": 74,
        "detail": "Story, skills, education, and goals are already filled.",
        "tone": "ready"
      },
      {
        "label": "Evidence strength",
        "value": 68,
        "detail": "Writing sample is attached; campaign project still helps.",
        "tone": "proof"
      },
      {
        "label": "Trust signals",
        "value": 62,
        "detail": "Working rights are verified; degree verification is pending.",
        "tone": "warning"
      },
      {
        "label": "Best opportunity match",
        "value": 86,
        "detail": "Junior Content Coordinator is ready to apply.",
        "tone": "ready"
      }
    ],
    "verifiedEmployabilityIndex": {
      "score": 78,
      "percentile": 68,
      "benchmarkLabel": "Entry marketing benchmark",